{
  "partner_id": "ptr_danafields_20260706",
  "display_name": "Dana Fields",
  "company": "Field Ledger Advisory",
  "email": "dana@fieldledger.co",
  "phone": "+1 202-555-0183",
  "website": "https://fieldledger.co",
  "partner_type": "cpa_bookkeeper",
  "partner_tier": "tier_2",
  "onboarding_path": "referral_only_partner",
  "primary_audience": "Contractors and service businesses with cash flow planning needs.",
  "secondary_audiences": [
    "local_smb",
    "tax_planning_clients"
  ],
  "risk_level": "low",
  "status": "needs_review",
  "tags": [
    "partner_type_cpa_bookkeeper",
    "tier_2",
    "referral_only",
    "cash_flow_readiness"
  ],
  "recommended_resources": [
    "Funding Product Matrix",
    "Business funding readiness checklist",
    "Referral partner scripts"
  ],
  "recommended_campaigns": [
    "Cash Flow Gap Referral Script",
    "Tax Season Funding Readiness Email"
  ],
  "next_action": "Send referral-only onboarding pack and schedule a 20-minute partner fit call.",
  "notes": "Strong trust channel; keep copy educational and readiness-based. No approval promises, no guaranteed funding amounts, and no credit repair framing.",
  "created_at": "2026-07-06T10:20:00-04:00",
  "updated_at": "2026-07-06T10:20:00-04:00"
}
